Article Name,Citations,summary,Link to Article
Vascular complications associated with intraaortic balloon pump supported percutaneous coronary intervention (PCI) and clinical outcomes from the British …,"T Kinnaird, R Anderson, S Gallagher… - Catheterization and …, 2021 - Wiley Online Library","… Furthermore, in parallel with increasing patient age and the uptake of transaortic valve 
replacement (TAVR), severe concomitant valve disease is also more prevalent. With increasing …",https://onlinelibrary.wiley.com/doi/abs/10.1002/ccd.29549
Cerebral embolic protection during transcatheter aortic valve replacement,"F Yashima, A Briasoulis, T Kuno, M Noguchi… - Cardiovascular …, 2021 - Elsevier","Background It is controversial that cerebral embolic protection devices (CEPDs) reduce clinical 
stroke during transcatheter aortic valve replacement (TAVR). Herein, we investigated the …",https://www.sciencedirect.com/science/article/pii/S1553838921002542
Outcomes and Contemporary Trends in Surgical vs Transcatheter Aortic Valve Replacement in Patients with Chronic Obstructive Pulmonary Disease,"MZ Khan, AA Alharbi, S Zahid, MU Khan, W Ullah… - Structural …, 2021 - Taylor & Francis","… over the study period in the TAVR group from 4.8% to 1.5%. … outcomes in patients undergoing 
either TAVR or SAVR and is one of … since the approval of the TAVR procedure in the COPD …",https://www.tandfonline.com/doi/abs/10.1080/24748706.2021.1931736
Arrhythmias in relation to mortality after transcatheter aortic valve replacement,"BP Dhakal, KA Skinner, K Kumar, K Lotun… - The American Journal of …, 2020 - Elsevier","… AV type and size used in the TAVR procedure was also studied. Post-TAVR, we examined 
whether a pacemaker was implanted and mortality based on last known chart documentation. …",https://www.sciencedirect.com/science/article/pii/S0002934320303387
TCT-842 Embolic Particles Show Surprising Size Dependent Predilection for Cerebral versus Peripheral Arteries: Results from Computational Fluid Dynamic …,"S Shadden, N Nemoto, W Pedersen, J Lesser… - Journal of the American …, 2012 - jacc.org","… To better understand emboli arising from procedures such as TAVR, we built a computa… 
Blood flow was modeled by the Navier-Stokes equations using pulsatile inflow at the inlet and …",https://www.jacc.org/doi/full/10.1016/j.jacc.2012.08.888
Personalized intervention cardiology with transcatheter aortic valve replacement made possible with a non-invasive monitoring and diagnostic framework,"S Khodaei, A Henstock, R Sadeghi, S Sellers… - Scientific Reports, 2021 - nature.com","… in both pre and post-TAVR, proper diagnostic methods are still … in both pre and post-TAVR 
and its progression has been … for patients with C3VD who undergo TAVR to quantify metrics of:…",https://www.nature.com/articles/s41598-021-85500-2
P6029 impact of elixhauser comorbidity score on the outcomes of transcatheter aortic valve replacement,"V Nagaraja, P Generaeux, M Cohen… - European Heart …, 2018 - academic.oup.com","… Whilst the impact of individual comorbid conditions on clinical outcomes following TAVR … 
undergoing TAVR in the National Inpatient Sample (NIS). Methods: TAVR procedures were …",https://academic.oup.com/eurheartj/article-pdf/doi/10.1093/eurheartj/ehy566.P6029/25577811/ehy566.p6029.pdf
European experience and perspectives on transcatheter aortic valve replacement,"WR Davies, MR Thomas - Progress in Cardiovascular Diseases, 2014 - Elsevier","… After all, Europe provided the birthplace for the first clinical TAVR and allowed commercial 
… examining TAVR in a lower risk cohort, the European adoption of the TAVR technology …",https://www.sciencedirect.com/science/article/pii/S0033062014000267
Improving transcatheter aortic valve interventional predictability via fluid–structure interaction modelling using patient-specific anatomy,"V Govindarajan, A Kolanjiyil… - Royal Society …, 2022 - royalsocietypublishing.org","… (TAVR) is now a standard treatment for high-surgical-risk patients with severe aortic valve 
stenosis. TAVR … pre- and post-TAVR dynamics of a patient who underwent a 23 mm TAVR and …",https://royalsocietypublishing.org/doi/abs/10.1098/rsos.211694
TCT-361 Clinical Outcomes in Patients Undergoing Percutaneous Coronary Intervention Treated With Colchicine,"CS Jimenez, JS Sanchez, F Hayat, J Chang… - Journal of the American …, 2021 - jacc.org","… dural complications during transcatheter aortic valve replacement (TAVR). The balloon-expandable … 
patients with severe aortic stenosis who underwent TAVR with S3U at 3 high-volume …",https://www.jacc.org/doi/full/10.1016/j.jacc.2021.09.1214
Predictive model for thrombus formation after transcatheter valve replacement,"H Hatoum, S Singh-Gryzbon, F Esmailie… - Cardiovascular …, 2021 - Springer","… The two main energy sources of neo-sinus (NS) washout after TAVR include the jet flow … 
The continuity equation and Reynolds averaged Navier-Stokes equations with a shear-…",https://link.springer.com/article/10.1007/s13239-021-00596-x
P6027 Drug eluting are superior to bare metal stents in patients with end-stage renal disease on dialysis: a meta-analysis,"VA Galiffa, G Crimi, V Gritti, V Scotti… - European Heart …, 2018 - academic.oup.com","… Whilst the impact of individual comorbid conditions on clinical outcomes following TAVR … 
undergoing TAVR in the National Inpatient Sample (NIS). Methods: TAVR procedures were …",https://academic.oup.com/eurheartj/article-pdf/doi/10.1093/eurheartj/ehy566.P6027/25577770/ehy566.p6027.pdf
Immersogeometric fluid–structure interaction modeling and simulation of transcatheter aortic valve replacement,"MCH Wu, HM Muchowski, EL Johnson… - Computer methods in …, 2019 - Elsevier","… The goal of this paper is to develop a computational FSI framework for TAVR simulations in 
order to … The blood flow in a deforming artery is governed by the Navier–Stokes equations of …",https://www.sciencedirect.com/science/article/pii/S0045782519304219
